### ISSUE TITLE
mediaCCC network error

### ISSUE THREAD

**Issue by mqus** [TeamNewPipe/NewPipe#2777]
- [x] I carefully read the [contribution guidelines](https://github.com/TeamNewPipe/NewPipe/blob/HEAD/.github/CONTRIBUTING.md) and agree to them.
- [x] I checked if the issue/feature exists in the latest version.
- [ ] I did use the [incredible bugreport to markdown converter](https://teamnewpipe.github.io/CrashReportToMarkdown/) to paste bug reports.

Android Version: 4.4.2
Newpipe version: 0.17.4

Hi!
I'm using newpipe for a while now and it's great!
When I tried watching conference videos from the media.ccc.de repository, it didn't work.

### Steps to reproduce:
1. Select MediaCCC on the left
2. Select Conferences

### What Should happen (I think, it didn't work once for me): 
Open a list of conferences
### What does happen:
Shows the text "Netzwerkfehler" (I'm german, means "network error") with a red "Wiederholen" ("repeat") button below. pressing the button will cause text and button to blink briefly.
I do have a internet connection and using youtube works fine. Accessing media.ccc.de from firefox also works.

From my experience, Android apps sometimes fail with https connections because Android 4.4.2 does not support TLS 1.1 and 1.2 by default. But I have no clue if that's the case here.

**Comment by theScrabi** [comment]
Give it some time, it looks like media.ccc.de is currently not available.
![grafik](https://user-images.githubusercontent.com/1891273/68109033-dff94080-fee9-11e9-893a-4d1afe45fff4.png)

**Comment by mqus** [comment]
not really, it didn't work for months(in older versions). Also: yersterday I could open the site in my browser(firefox) bit still not in newpipe

**Comment by mqus** [comment]
now the website works again but the app still shows the same error. Please reopen the issue.

**Comment by TobiGr** [comment]
I don't have any problems with media.ccc.de. Everything works fine: search, conferences, video detail, watching videos,...

**Comment by mqus** [comment]
Is there a way to get/view logs or something like that? And which Android version do you have, @TobiGr?

I tried `adb logcat` but that didn't show anything I could link to the error.

**Comment by theScrabi** [comment]
Maybe one should test it on android 4.4.

**Comment by mqus** [comment]
I tried analyzing the network traffic via wireshark and got the following packets for one "retry":

| No. | Time        | Source                    | srcport | Destination      | dstport | Protocol | Length | Information                                                                                                      |
|-----|-------------|---------------------------|---------|------------------|---------|----------|--------|------------------------------------------------------------------------------------------------------------------|
| 1   | 0.000000000 | 10.10.10.53               | 9401    | dns.google       | 53      | DNS      | 76     | Standard query 0xe429 A api.media.ccc.de                                                                         |
| 2   | 0.018331267 | dns.google                | 53      | 10.10.10.53      | 9401    | DNS      | 110    | Standard query response 0xe429 A api.media.ccc.de CNAME app.media.ccc.de A 195.54.164.138                        |
| 3   | 0.552476420 | 10.10.10.53               | 33141   | app.media.ccc.de | 443     | TCP      | 74     | 33141  >  443 [SYN] Seq=0 Win=14600 Len=0 MSS=1460 SACK_PERM=1 TSval=22005741 TSecr=0 WS=64                      |
| 4   | 0.562116169 | app.media.ccc.de          | 443     | 10.10.10.53      | 33141   | TCP      | 74     | 443  >  33141 [SYN, ACK] Seq=0 Ack=1 Win=28960 Len=0 MSS=1452 SACK_PERM=1 TSval=3731660101 TSecr=22005741 WS=128 |
| 5   | 0.602467768 | 10.10.10.53               | 33141   | app.media.ccc.de | 443     | TCP      | 66     | 33141  >  443 [ACK] Seq=1 Ack=1 Win=14656 Len=0 TSval=22005746 TSecr=3731660101                                  |
| 6   | 0.604436329 | 10.10.10.53               | 33141   | app.media.ccc.de | 443     | TLSv1    | 221    | Client Hello                                                                                                     |
| 7   | 0.613581926 | app.media.ccc.de          | 443     | 10.10.10.53      | 33141   | TCP      | 66     | 443  >  33141 [ACK] Seq=1 Ack=156 Win=30080 Len=0 TSval=3731660114 TSecr=22005748                                |
| 8   | 0.616091576 | app.media.ccc.de          | 443     | 10.10.10.53      | 33141   | TCP      | 66     | 443  >  33141 [RST, ACK] Seq=1 Ack=156 Win=30080 Len=0 TSval=3731660115 TSecr=22005748                           |
                                                                 |

It seems that my suspicions could be coming true, as newpipe seems to send a TLSv1.0 Hello and gets a TCP connection reset in return... To simulate this, I used curl and got a similar result:

```
$ curl https://media.ccc.de -I -vv --tls-max 1.0
*   Trying 2001:67c:20a0:b::138:443...
* TCP_NODELAY set
* Connected to media.ccc.de (2001:67c:20a0:b::138) port 443 (#0)
* ALPN, offering h2
* ALPN, offering http/1.1
* successfully set certificate verify locations:
*   CAfile: /etc/ssl/certs/ca-certificates.crt
  CApath: none
* TLSv1.0 (OUT), TLS handshake, Client hello (1):
* OpenSSL SSL_connect: SSL_ERROR_SYSCALL in connection to media.ccc.de:443 
* Closing connection 0
curl: (35) OpenSSL SSL_connect: SSL_ERROR_SYSCALL in connection to media.ccc.de:443 

```
In wireshark, this exchange looks exactly the same as above.

**Comment by mqus** [comment]
If I'm right, https://github.com/ssllabs/ssllabs-scan/issues/258 is the issue I'm encountering.
One solution is linked to there: http://blog.dev-area.net/2015/08/13/android-4-1-enable-tls-1-1-and-tls-1-2/ but I don't know if this is applicable here because I know nothing about the newpipe codebase.

**Comment by mauriciocolli** [comment]
@mqus You're right, just tested on the emulator, same result. The only protocols reported as enabled on the emulator (4.4) are: SSLv3 and TLSv1 ([following the documentation](https://developer.android.com/reference/javax/net/ssl/SSLSocket#protocols)).

If you want to test it too, [here's a version with the supported protocols enabled](https://github.com/TeamNewPipe/NewPipe/files/3812353/app-release.apk.zip) (the downloader and the player are not working because they'd have to use that hack as well, just a test for now).

**Comment by mqus** [comment]
@mauriciocolli your version works for me.

**Comment by theScrabi** [comment]
@mqus if you want to debug newpipe, you can get a debug version, enable ADB, and use the chrome debug tools to check the track the trafick (even unencrypted). This is because we backed [Stetho](https://facebook.github.io/stetho/) into the app.

**Comment by Gymcap** [comment]
MediaCCC conferences are loading fine for me on v1.7.4.

**Comment by mqus** [comment]
@Gymcap Yes, but on which android version?

**Comment by mqus** [comment]
I just had a try at fixing this myself and I did get the Kiosk and Downloads to work. I'm just clueless about where to begin with the player. I do know some java but I'm pretty much a beginner when it comes to app development... I'll open a PR tomorrow.
